{
  "cycle_id": "world-music-languages-2026-10-11-002",
  "department": "world-music-languages",
  "question": "Which claims in GA's DADGAD answer follow from its tuning table, and which cultural or musician-facing claims require evidence beyond the code?",
  "production_path": [
    "investigation: observe hypothesize test conclude reflect",
    "source reading: pin GA AlternateTuningsSkill and its unit-test declarations",
    "test: cross-check orientation, three string changes, open-note sets, lookup confidence, and five answered exercises"
  ],
  "hypothesis": "At the pinned GA revision, a successful DADGAD table lookup combines checkable string notes with uncited cultural Flavor text; its numeric response confidence does not validate that cultural text or prove live chatbot routing.",
  "test_method": "cross_validation",
  "evidence": [
    "At GA commit dc2e74cbd992a298f67efb928b5b3754615e1924, Common/GA.Business.ML/Agents/Skills/AlternateTuningsSkill.cs states a low-to-high string convention and stores standard E/A/D/G/B/E and DADGAD D/A/D/G/A/D. Comparing the arrays changes strings 6, 2, and 1 by minus two semitones each.",
    "The same source stores Open D D/A/D/F#/A/D. Relative to DADGAD, string 3 changes G to F# by one semitone; the distinct open-string pitch sets are D/G/A and D/F#/A. The source labels their unfretted collections Dsus4 and D major respectively.",
    "The DADGAD Flavor field asserts associations with Celtic and modal folk and Indian-flavored playing but provides no supporting cultural or recording citation. The lesson attributes that language to the source rather than verifying its historical or cultural accuracy.",
    "The pinned ExecuteAsync method tries named patterns, then reverse lookup. AnswerTuning formats Notes, VsStandard, and Flavor, while Result sets Confidence=1.0f for the successful lookup. CanHandle returns false with a semantic-routing comment; no live routing was observed.",
    "Tests/Common/GA.Business.ML.Tests/Unit/AlternateTuningsSkillTests.cs has no dedicated DADGAD outcome case at this revision. The lesson's five answers are source-derived and no test suite, chatbot session, physical setup, performance, translation, or learner study was run. Research duration was not instrumented; duration_seconds=0 records that limitation."
  ],
  "conclusion": "confirm",
  "belief_value": "T",
  "belief_confidence": 0.92,
  "duration_seconds": 0,
  "timestamp": "2026-10-11T22:08:48Z"
}
